id,message_id,content,user_id,session_id,reply_to_message_id,created_at
352,RJEgu5F99YnNaD6pJbJPWb45onS-RRf_,"[Yes, that was something that Serge suggested. I would have prefered to stay with a more natural conversation, so I will tell him our impressions. But a general theme/task for the tutor to follow could be a good help! Ok for Monday, 10:00 :)]",8,20,,2024-08-29 10:58:31.378773
353,eSLwhvZV38NHdSKqC4jsJ2pMszxcpVnS,"[Yeah, I could imagine that they might want to have similar topics across the participants for easier analysis... but I don't know how that would work with the AI, if the chatbot would keep trying to redirect the topic, or if it would follow the lead of the student.]",12,20,,2024-08-29 10:59:24.599828
354,1C_gYenIh0BlS8cosMS429UiKtE2Gxhw,"[OK, Monday at 10 is in my calendar!]",12,20,,2024-08-29 10:59:35.478549
355,vakoAiwP_EUDchp_5vQ8CV6f3DAq_U_N,[I will talk to him about it this afternoon! And I will obviously keep you in touch next time :) Thank you for your time!!],8,20,,2024-08-29 11:00:26.752096
356,UPfcEkmN1E_T846r_ANZBg-EN3rHuKaZ,"Bon week-end à l'avance, Tyler! Merci encore pour ta participation :)",8,20,,2024-08-29 11:00:47.383454
357,V8ofACSSU59aUtAjHuJd-8XDn-HbcyKC,"[Awesome, thanks so much Victoria! Have a great day, and say hi to Serge from me!]",12,20,,2024-08-29 11:00:48.462017
358,hLVKEQADunwDgbHv4t-xIxOZDK1FxHQU,Will do!! :),8,20,,2024-08-29 11:00:55.592778
359,Svpzla_r5wxR1S0UjfmDc-I9NryFSBJw,"Ahaha oui on peut dire ça, j'ai 24 ans ! J'ai terminé mon master l'année passée et j'ai refait un master cette année. Je vais seulement commencer à travailler !",8,20,,2024-08-30 11:42:26.444659
360,U6rzMGtgzUP5k33qfrJx8t0cEoY3vlzr,,8,20,,2024-08-30 11:42:32.185830
361,Y5feyaXy5U23SMRAlvjP5Zq8vk3STLox,Coucou Tyler ! Tu vas bien ? :),8,22,,2024-09-02 09:59:06.345483
362,W8WxJgMqJ30it1EQztBKprue_VUUZeaA,"J'ai vu ton email. Tu peux peut-être essayer quand même de souligner/surligner un mot dans un de mes messages, peut-être que ça fonctionne aussi de ton côté !",8,22,,2024-09-02 09:59:45.525978
363,eb8Wicm1itkAElTXGq63wATW6fp91x97,"Salut Victoria! Ça va bien, merci, et toi?",12,22,,2024-09-02 10:00:09.179300
364,5gyWoVX5eg9Vm5e53W3Sp3uz_n626qjy,Ca va aussi :) Qu'est-ce que tu as fait ce week-end?,8,22,,2024-09-02 10:00:24.328688
365,h8W3Y8CTQ0a99rMJVVHPvnXKUXWjHG7c,"Ce samedi j'ai travaillé pour la nouvelle année (le fiche descriptive, le syllabus, et les powerpoints avec les instructions pour des joues pour faire dans les cours), et j'ai appelé ma famille, et j'ai fait un mot croisé avec un copain par Skype :)",12,22,,2024-09-02 10:03:52.688924
366,gOtsv3wlm9cn2RZ-6lEIQ77YBiSfbrdf,Pour des jeux? :),8,22,,2024-09-02 10:04:46.270707
367,fvu-g4VVnbAFw8Q34HFo_Q5a5moJ84Jc,Tu bosses même le week-end!! Tu es courageux!,8,22,,2024-09-02 10:05:04.497594
368,PTDyUEnv1vZJwZpVjNgMyWLo8-gJrmvf,"Et hier, après le mis, j'ai déjeuné avec un autre copain, et j'ai visité mes copains (et mes (godchildren)) à Leuven. J'ai aussi eu un (rehearsal) pour notre pièce du théâtre ce soire.",12,22,,2024-09-02 10:05:29.157012
369,lNVMcf94QuCZ73ZDRJSgVY5y75TAT4Ia,"Haha oui, c'était un week-end très occupé!",12,22,,2024-09-02 10:06:29.702997
370,uwpGzKU3ckAzqkZu7cyvyUUS-PHceDL2,"Et toi, qu'est-ce que tu as fait ce week-end?",12,22,,2024-09-02 10:06:48.695427
371,Fdt8iw_zNF0mHuA95HERhprjXyFWXR-S,Après le mis? Qu'est-ce que tu veux dire? :),8,22,,2024-09-02 10:06:57.742440
372,FXOolNqB26aEKJ1TUAOBwUWXiWEQG-Lt,"Ce soir, tu as déjà une 'vraie' représentation de ta pièce de théâtre alors?",8,22,,2024-09-02 10:07:43.840801
373,IyO9mvDMssuAWD7SdYav1E4-izYiN6gE,"[OK, something I notice is that when you've added a comment, I can't comment on your comment, or add a comment to the same word.]",12,22,,2024-09-02 10:07:52.327459
374,XCwEcDXGW6D_T7cirFBapkQb_6ztUzcl,"Vendredi soir, je suis allée à une soirée entre amis. Samedi, je n'ai rien fait de spécial. Et hier, nous avons passé la journée à la mer en famille, à Nieuport, pour l'anniversaire de mon papa !",8,22,,2024-09-02 10:08:56.596293
375,a5pDWTJXFjo_G977Hqnhr9kx-1-cKhRp,Je prends note de ton commentaire. Je note tous nos feedbacks dans un Word pour les communiquer à Serge !,8,22,,2024-09-02 10:09:19.617942
376,GCMQGq9zoyeH2Bw0rIH5EEOhCGflPBb3,"[It might also be useful if there were some sort of notification indicating that a comment has been made, or something has been underlined, otherwise it's very easy not to notice. The blue underline is hard to see on my end because my chats have a blue background.]",12,22,,2024-09-02 10:09:39.505556
377,YPXcqNcMuUScFIXCKwPOWCktmZyZU1v7,"[Feel free to comment on what you want with square brackets, like we did before!]",8,22,,2024-09-02 10:09:44.769551
378,GCMQGq9zoyeH2Bw0rIH5EEOhCGflPBb3,"[It might also be useful if there were some sort of notification indicating that a comment has been made, or something has been underlined, otherwise it's very easy not to notice. The underlines are hard to see on my end because my chats have a blue background.]",12,22,,2024-09-02 10:10:39.808630
379,V8psbQq9IIhJBzAeS5mAHCGI7pWc1bKg,"[Yes, true! Because you don't automatically go back to your own messages so a notification would be better! For the color, I think that could be changed easily, I'll tell Serge!]",8,22,,2024-09-02 10:10:53.968394
380,hf7cPKEAnOGPXIysBs2AIY4WaO10ZmD7,"Non, j'ai eu juste une répetition, pas une répresentation :) Nous avons encore un mois avant la première ;-)",12,22,,2024-09-02 10:12:29.908048
381,B5j4fyK1i_V6cXuOxcoXB4Uu6_yjoAWB,"Ooo à la mer! Hier était une bonne journée pour ça, il fasait très chaud!",12,22,,2024-09-02 10:13:40.169331
382,T-Kz4K4R2c91Y1Kbcq3RbDg6gXk7Bkc9,"(Tu bosses = tu travailles, en langage moins 'formel)",8,22,,2024-09-02 10:13:57.133469
383,8oy74mBNEFRqaJSdmirGji_IlL6pvLKn,"Attend, à Nieuport... en Wales? haha",12,22,,2024-09-02 10:13:59.235340
384,VxfQ944fcTuXViNuQq5fN3ZEqAGv3GjX,(et bonne anniversaire à ton papa!),12,22,,2024-09-02 10:14:10.639943
385,QEq4aAK6kAIWyRzbbzq08ceQKdlv-3WG,"Oh, alors tu voulais dire *après la messe? :)",8,22,,2024-09-02 10:14:30.579294
386,d_-DmLvGIeo0TA61QZn6gLle7VDx04Nx,"Oui, il a fait vraiment bon! Nieuport, ou Nieuwpoort en néerlandais, c'est à la mer du Nord, en Belgique ahah",8,22,,2024-09-02 10:15:13.765696
387,pTJMcUjMKVaRCXXXjt0Ln0yL4EEsL6mN,"[I also see it's not possible to edit, change, or remove underlines/comments.]",12,22,,2024-09-02 10:15:29.527199
388,UX-_ZZ6jlHY2Dt3P_G1iR69NrDM4VAO2,"[Oh, that is weird and not practical at all!!]",8,22,,2024-09-02 10:15:47.289039
389,c92D5pCBx-oPLvWlmJWOLeuxlV1DLs7K,"Ah, je vois, tu es restée en Belgique, c'est bon :D",12,22,,2024-09-02 10:16:02.733207
390,D2AhHGP4AO3IvwanOWSNQjkzEeAi_OY6,Merci pour lui ;),8,22,,2024-09-02 10:16:20.888143
391,KvyzLpLEh_EM9aGH-0J15G5pzMOo1PW1,"Oui, c'était déjà plus de 2 heures de route !!",8,22,,2024-09-02 10:16:29.305163
392,foHohJ5c7RohYGWVuxcJZbSzsQ_UsBEj,Et comme est-ce que vous avez celebré son anniversaire?,12,22,,2024-09-02 10:16:53.185195
393,K4sXzsjq40Zm_0HBT2JHWLc01Os_hsU1,"(Ou, comme était-ce que?)",12,22,,2024-09-02 10:17:34.522952
394,mswLmvEbjHHO7_f1yarHSbxOg17hYd8W,Comment on a fêté son anniversaire?,8,22,,2024-09-02 10:19:03.681913
395,bzKPaPvt7aHJKt7C9jHKi66fgFB7K5HW,"Nous nous sommes promenés sur la plage, nous avons pris un verre. Puis, nous sommes allés diner dans un chouette restaurant avec beaucoup de fruits de mer. Tu aimes les fruits de mer? Je voulais justement discuter de cuisine avec toi :)",8,22,,2024-09-02 10:20:13.136317
396,vJuwIEBeEHLTQ9BX8MKzMrqHD0aG3A4P,"Oh, c'est génial! Un bon fête! J'aimes bien quelques fruits de mer, mais je suis vétetarien, donc je ne le mange pas plus. (anymore?)",12,22,,2024-09-02 10:22:33.254666
397,Gzv1eLBgmaq5vSa6u1w3qD9nO5zJLB3D,"Oui, on peut discuter de cuisine!",12,22,,2024-09-02 10:23:03.144509
398,4EjkzjTOIPVglHyguxkmfBmZDD6QmMIE,(végetarien ... je ne sais pas où le 'g' est allé haha),12,22,,2024-09-02 10:24:00.073468
399,TyM1RHpFUX58W4M184RsJffRPEuP1y4H,"Ah, je vois! Tu es végétarien depuis longtemps?",8,22,,2024-09-02 10:24:33.801224
400,ARidOE-tOzuVyK5GOV886upci-1rqA9s,(quand est-ce que on dit 'en' et 'le/la'? Je n'en mange plus / je ne le/la mange plus?),12,22,,2024-09-02 10:25:24.367210
401,ihR4qQl196bxUjFdhM7b4jP7-ifJ_ixT,"Oui, je suis devenu végétarien il y a dix ans, parce que j'ai un malade d'estomac, et c'était mieux pour mon santé.",12,22,,2024-09-02 10:26:36.882970
402,M5gI3hg9Ggy4i10OL5HoHvCDI_B5HOD9,"On ne dit jamais ""je ne LE/LA mange plus"". Le ""en"" renvoie aux mots d'avant. Exemples : j'aime bien les frites, mais je n'en mange pas souvent. J'adorais les boulettes, mais comme je suis végé, je n'en mange plus.",8,22,,2024-09-02 10:26:51.353001
403,mePr1Z6KA6oTrQgO3sOUEDfzFZxyrPQK,"(Je comprends, merci!)",12,22,,2024-09-02 10:27:20.327260
404,YXB4Ful7peAkrGOreC3T0ZL0hyJ0jG7f,(Je pense que... haha),12,22,,2024-09-02 10:27:41.600578
405,iQXvYlNigXWE08hSOKXzW8aMnNsW9gDg,( N'hésite pas si ce n'est pas clair :p ),8,22,,2024-09-02 10:27:57.194934
406,bgfQmKa4Ys1IQ-86QE7QJZ9RxLiq4DPU,Donc ça fait longtemps que tu ne manges plus de viande ! Quel est ton plat préféré?,8,22,,2024-09-02 10:28:18.652274
407,0-z6UDWGY6DlBy3H82p7XFMEEOknQRbB,"(Je comprends que tu dis, mais je ne suis pas sûre que je comprends les reglements haha)",12,22,,2024-09-02 10:28:31.667721
408,1TnCSq04voVf6uqOrnpkKg1f-mBaXx9j,"Mon plat préféré, c'est difficile! haha Il change jour-à-jour.",12,22,,2024-09-02 10:29:42.080844
409,QD9PNKgU80YYdrE8xTQP2vdUHv9qarVw,"(Je ne crois pas qu'il y ait vraiment de règle à suivre. Ce n'est pas une grosse faute de dire ""je ne le/la mange plus"", surtout qu'on te comprend très bien si tu dis ça. C'est juste plu ""normal"" de dire ""j'EN mange"" :))",8,22,,2024-09-02 10:30:02.504617
410,QD9PNKgU80YYdrE8xTQP2vdUHv9qarVw,"(Je ne crois pas qu'il y ait vraiment de règle à suivre. Ce n'est pas une grosse faute de dire ""je ne le/la mange plus"", surtout qu'on te comprend très bien si tu dis ça. C'est juste plus ""normal"" de dire ""j'EN mange"" :))",8,22,,2024-09-02 10:30:14.581043
411,RfDREHGf5nosMDaa60idYsvLUC0cTTIS,"Ahaha je vois, il change de jour en jour ! Ou chaque jour :)",8,22,,2024-09-02 10:30:39.895759
412,0Qv08pX-yy1GRrA0Hizt9tX_UT0ITqZM,"Quelques jours je veux un poké, ou un wok, ou des pâtes, ou un pizza, ou des sushi...",12,22,,2024-09-02 10:31:00.163408
413,T0jcPSKcrofgo0OStvoj58iNXAEx_6J8,"Plutôt asiatique ou italien, alors :)",8,22,,2024-09-02 10:31:26.224681
414,svtwgkeGxMqStHQXQubd0qB2siwgg_7z,Mais j'aime le fromage! haha,12,22,,2024-09-02 10:31:39.535155
415,mOfx6ztJTqZWFPl5NFI35fft1ExQES_j,"( Je viens de voir un ancien commentaire : oui, célébrer = fêter (synonymes). Ce sont tous les deux des verbes !)",8,22,,2024-09-02 10:32:23.150384
416,UmqGqr_V_KmXynIw1v1D_HC340OQkghx,"Oui, mais les plats de l'ouest sont toujours 'viande et patate' haha",12,22,,2024-09-02 10:32:30.098342
417,Bd7MjVXkhZXvFdol5Kkjz9UBsn0mUe2o,"Oui, c'est vrai. Et les plats typiques de la Belgique sont aussi souvent avec de la viande et des pommes  de terre !",8,22,,2024-09-02 10:33:25.629189
418,XpBsRR3nlxdyNkJY-FXmbclGqPkv-A07,"Moi, je suis justement intolérante au lactose (donc au lait, au fromage, ...).",8,22,,2024-09-02 10:33:35.988521
419,GADc7N30TTbSMNs-mMPF0PnhT5ruLoUC,"Je dois prendre des médicaments avant, sinon je suis malade. Et je ne bois jamais de lait de vache !",8,22,,2024-09-02 10:33:56.122347
420,Em-SbFT_TSE0uNDflclfZyMERhWM_O_L,"Oh, non, je suis très desolé!",12,22,,2024-09-02 10:34:08.662854
421,4nRU27wPU1vE6LOhaeFsug7Wk6974ekj,;-),12,22,,2024-09-02 10:34:13.185619
422,BQn4B8G7sqz1bZS_28KY7DCEkoPU9nSu,Le fromage est très delicieux,12,22,,2024-09-02 10:34:30.905941
423,ACQK15ayvmj3lLhX3m3MG9fdFODQtRHl,haha,12,22,,2024-09-02 10:34:33.330429
424,YZ_U6-EIKYob_-ncfIHfCEfgQ1Wa-gyj,"(""Célébrer"" se dit, c'est parfait! C'était juste pour te donner un synonyme :))",8,22,,2024-09-02 10:34:45.097635
425,sm9WqX76oRFZbM0tSPONm8uOXFmQILps,"Oui, je suis triste de ne pas pouvoir en manger autant que je le veux ahaha, j'adore aussi le fromage!",8,22,,2024-09-02 10:35:17.914825
426,licm0TExsP2Boc9NqeOI3mot5GhdDAJW,"Oh, le lait – je bois beaucoup du lait aux les États Unis, mais ici, je le déteste!",12,22,,2024-09-02 10:35:26.545308
427,8XPdtjzUW3Oq6mgawD6v8OYJEPIoJCFs,"Pourquoi, le lait est différent ici? Et la cuisine des USA ne te manque jamais?",8,22,,2024-09-02 10:35:42.275934
428,cwFdBgDy_uJ-gd1py4sFEA4VnRvSCGvd,"Je ne sais pas exactement le difference... le lait d'USA est pasturé (pasturized?), et ici c'est 'UHT', mais je ne sais pas si ça est trop different?",12,22,,2024-09-02 10:37:06.102635
429,cwFdBgDy_uJ-gd1py4sFEA4VnRvSCGvd,"Je ne sais pas exactement le difference... le lait d'USA est pasturé (pasturized?), et ici c'est 'UHT', mais je ne sais pas si ça est trop différent?",12,22,,2024-09-02 10:37:26.061832
430,3xORs5b9d1rD_FJVFjIpdukY2Dl4JhBL,"Ah ok, je ne savais pas du tout !! Je n'ai aucune idée si c'est différent !",8,22,,2024-09-02 10:38:05.380169
431,5pV8IEL25mVXdSl1gbc12s3pnWM8e7XG,"Je bois juste du lait d'amande, ou d'avoine 😅",8,22,,2024-09-02 10:38:20.922928
432,Hh-e9G-V50WYopMzW5ZQHdYM-hES_3Hi,"Je pense que c'est le différence (somehow), mais je ne sais pas comment haha Aux États-Unis, notre lait ne peut pas rester dehors le frigo...",12,22,,2024-09-02 10:39:51.821844
433,DEH-Qdn_Ex4NHuH3gYbbsWLrqwFjdvQ8,(avoine = oat),8,22,,2024-09-02 10:40:32.464831
434,YMJbPP5w157lkBmOxY-n9tNSNmr6_E5j,"Moi, j'adore les desserts, j'ai un dent sucré",12,22,,2024-09-02 10:40:32.950232
435,rZWDuXsjo_DdmRlY7JzrsNbRy27QvluD,"Je mange trop du sucre, je pence haha",12,22,,2024-09-02 10:40:55.639978
436,mIJig91hp6ROW97OdQwf0HSL53MPAjnC,Ahahah,8,22,,2024-09-02 10:41:24.980392
437,3E8UM0roXX5LCtrnamh3Wl1DC-SvyxtQ,"Moi, c'est tout le contraire!",8,22,,2024-09-02 10:41:28.546940
438,LK-kKSyz6jh-xdzkFOlnIidmLRW2Rxym,C'est vrai?,12,22,,2024-09-02 10:41:39.341592
439,KBAQJdGTiQkRv5jFjOLSx_jKfG1e8xX9,"Je suis plutôt salée, j'adore les apéros 🤪 les chips, les saucissons, les olives, ...",8,22,,2024-09-02 10:41:45.701189
440,EgzBf2B7DF-Zy6T6r6FQqTXuGisTLVbl,Je ne mange pas souvent de desserts.,8,22,,2024-09-02 10:41:54.666306
441,srW1wGn6Nr83-WV9GthFlaBFx7db31ns,Et tu aimes cuisiner? Tu 'patisses' toi-même des desserts?,8,22,,2024-09-02 10:42:15.867531
442,9nWr8hJXtCiGWEQwmAQSbl6ZPExpfB85,"oh, moi aussi! mais je ne peux pas terminer le repas sans quelques sucré",12,22,,2024-09-02 10:42:27.522296
443,cg9EDUFQXavadxyMEd-BhhjJQt-Sk76y,(une patisserie => le verbe 'patisser'),8,22,,2024-09-02 10:42:30.672878
444,9nWr8hJXtCiGWEQwmAQSbl6ZPExpfB85,"oh, moi aussi! mais je ne peux pas terminer le repas sans quelque sucré",12,22,,2024-09-02 10:42:36.655711
445,gWI7ZRPWUEur8cqouiYFpdZ05VS_nPFO,"Oui, j'aime cuisiner et patisser, mais malheureusement, je n'ai pas beaucoup de temps pour ça...",12,22,,2024-09-02 10:43:29.569030
446,pg5wobyHj-FvVSfpmEK5A5aoZVXxZcuG,"Tu dois être content ici en Belgique, avec tout notre chocolat! :p",8,22,,2024-09-02 10:43:33.512718
447,U12xgs3YQKRi8NlkpnlRhaQzu5b64r0b,"oui, c'est vrai que ça prend du temps!",8,22,,2024-09-02 10:43:44.047049
448,oZPVFUET9zcYABd907O0kAVokd9Qri8V,Oh ouaaaiiii j'adore les chocolates belges!,12,22,,2024-09-02 10:44:18.291331
449,NpJ9Mzz3qupPXbpwg4y5OXFepdUy_PZ7,"Je recevais les boites ""Hello Fresh"", mais maintenant, je reçois mes repas de La Brigade de Vero",12,22,,2024-09-02 10:45:51.694552
450,FOtkp8AUHbL8XaLNlivdckbjPGsiT0FI,"Ah oui, c'est pas mal, Hello Fresh! Ca fait moins de gaspillage. Mais je ne connais pas 'La Brigade de Vero'!",8,22,,2024-09-02 10:46:39.029593
451,FpauDEBfA63amQKmlGYeK9EC53KJ66vZ,"Je mets le plat dans le micro et après trois minutes, c'est prêt!",12,22,,2024-09-02 10:46:45.126656
452,QTZ6Glzy6iZvDnf76eoUUK52dOoqdmAs,"Tu les reçois directement chez toi aussi alors, c'est livré?",8,22,,2024-09-02 10:47:12.100581
453,72Ady1Lziywy4vlo9KUqkIux-q1W3XFI,"Et ce n'est pas trop souvent les mêmes plats, comme tu es végé?",8,22,,2024-09-02 10:47:25.429590
454,mtwFlz3oOYfScYA6XByCABeHnwt3BuUK,J'aimais vraiement Hello Fresh! Ils font les recipes très bons,12,22,,2024-09-02 10:48:00.101466
455,io22DVoWxx0LIx5SpxU2BeJZ9C0YhP8U,"Oui, c'est pratique et sain!",8,22,,2024-09-02 10:49:15.167110
456,jXVUdHOntUlCuQBVPsfNPtx7ptZNDmv4,"Oui, un jour par semaine, je reçois une boite avec dix repas (2x5, ou parfois 2x4+1+1), et chaque semaine c'est un peu différent (plus ou moins).",12,22,,2024-09-02 10:49:52.285080
457,NRCRp7Fiz1kl1U4jl4zDR9_LSBvfPzVt,"Oh, c'est vraiment sympa. Comme tu dis, tu gagnes beaucoup de temps!",8,22,,2024-09-02 10:50:48.378661
458,29Q26v9IsJIroU8PeJq_QSIILFOOSQHA,"Ca me donne faim, tout ça 😅",8,22,,2024-09-02 10:51:06.551307
459,eAb9WX6kz-TogThPW4PL63KdesNTKTuT,"Oui, mais c'est aussi un peu cher parfois",12,22,,2024-09-02 10:51:19.758617
460,COJ1FQRTHrne-4oObBg60IRCcFxO0qur,"Oui, c'est sur. Même quand je fais moi-même les courses et que je fais attention aux prix, c'est vite cher...",8,22,,2024-09-02 10:52:19.079215
461,i7RWP3FQQXuhxDl6d7dmSAde7eE5oHNx,"Pour notre prochaine session, est-ce que tu es libre le mercredi 11, le jeudi 12 ou le vendredi 13? Tu préfères encore vers 10h?",8,22,,2024-09-02 10:52:22.261354
462,hIRd2lnL_5VmQoHNewdQ2tzzlI0xQD-a,"C'est €100 par semaine, allors €10 par repas",12,22,,2024-09-02 10:52:24.553511
463,vHoaastwXbgn2-YFrfS6Y1UcM7JpIs0I,"Bon, le 12 septembre à 10h?",12,22,,2024-09-02 10:53:25.117087
464,dhDMsrlVENOtynII5Uac5lopyE6rXG6m,"Ah oui, quand même!",8,22,,2024-09-02 10:53:45.836023
465,7RKpqq4IpSrDQZearc0cBvOvwl0I7X9L,"Oui, c'est parfait pour moi.",8,22,,2024-09-02 10:53:51.007619
466,vXe-a7KK8Wpn6gQmMyL_4z9oF4QU5DmJ,Je vais tout de suite envoyer un mail à Serge pour les détails concernant les commentaires/surlignages!,8,22,,2024-09-02 10:54:12.031738
467,ZC9oG8kDBTJ-LckKZKfeh55SXm6fXIq0,"Super, merci beaucoup!",12,22,,2024-09-02 10:54:30.959394
468,o6GYQ-BMLVmzAcUCKbWIuiNrlwhG11DJ,"Merci à toi aussi! À la semaine prochaine, et bon appétit d'ici là 😜",8,22,,2024-09-02 10:55:04.403451
469,G5dSaRbRH-HgjKSEit4LGVbrgf31614x,Et pour toi! À la semaine prochaine!,12,22,,2024-09-02 10:55:21.717963
470,M7Lcyj_IpUIqd7ufmyUwv41tsQTy2zhS,Bonjour comment tu t'appelles?,13,23,,2024-09-02 13:14:05.159906
471,lsqTdjr0Mzwn1eSW2Ngit-H59kmGrbUm,ah oki là ça marche,10,27,,2024-09-03 10:10:59.373305
472,JveAXtn0dAL6pztTmpV7m5Y1PGDiSti4,depuis le début j'appuyais sur le bouton jaune session immédiate et je ne pouvais rien écrire dans la session,10,27,,2024-09-03 10:11:20.363675
473,Kb-pMJFPFM8S39oq3XzQ0i66JJgjqeeU,"ici j'ai appuyé dans ""en cours""",10,27,,2024-09-03 10:11:34.689936
474,DPmFB1G6IfkKce3Q181b6Ci-dEhizKcU,"Oui, j'ai bien reçu, mais parmi toutes les conversations dans 'en cours', je ne voyais pas dans laquelle j'avais reçu des messages...",8,27,,2024-09-03 10:12:27.154573
475,5Lpz0qv_F4FQ-by6xiDsL0y_lB3z8sEP,Quel bazar!,8,27,,2024-09-03 10:12:30.046420
476,LgzLAtWpuHIuTr2U2eXgWZakzTLDXWif,et ben! on n'est pas sorti de l'auberge!,10,27,,2024-09-03 10:13:14.822752
477,0pse269n5QRprCFId_VUZQFUphx_EJ-M,"J'en prends note pour le signaler à Mr Bibauw, alors. Normalement, le problème du décalage horaire était réglé... Mais ce n'est pas le cas !",8,27,,2024-09-03 10:13:16.746778
478,gAbKIDvn5YklI4lWq8bge3qX6KPndIwk,Ahahah vraiment,8,27,,2024-09-03 10:13:19.026231
479,C1xaLt5jMvwO1p_T26DxFUsudjp1XEAb,"si jamais demain, jeudi et vendredi je serai sur un autre fuseau horaire",10,27,,2024-09-03 10:14:03.599499
480,xBCPBwoBr6w_3r-FS9Ylw5875t3ookj9,"Je pense que ça ne change rien, comme ici j'ai fait le test avec le fuseau horaire des USA puis celui d'Angleterre et ça n'a pas fonctionné! Malheureusement, je ne suis plus dispo le reste de la semaine. Mais de toute façon, notre test est clair je crois ahaha, je vais envoyer un mail à Mr Bibauw!",8,27,,2024-09-03 10:15:24.837448
481,pRIqC7wxpopO3yCrq7A5LiRCJYfYIqtt,oki bon courage pour la suite alors!,10,27,,2024-09-03 10:16:02.626674
482,YDY95XviBXuOKRKLZGlXDj52YPfmHE_E,"Merciii, à toi aussi !!",8,27,,2024-09-03 10:16:11.635521
483,hdXawfpR2Ewn-zhua-G6C0BKhBiWsslr,Bonjour Tyler! :),8,34,,2024-09-12 09:59:44.740728
484,FII-0WZxSSKh4hrlyIhCMUaqRlg7d6FH,"Bonjour, Victoria! Ça va?",12,34,,2024-09-12 09:59:58.239099
485,mX9xJd7JjQlKFxOhMyd5af6jtf4GHsdX,"Ca va bien, et toi?",8,34,,2024-09-12 10:00:23.616737
486,z-R_9UkEcVdciGDJKX_TXk_kMkUdJcCo,[A note for Serge: the session only shows on the dashboard after clicking refresh. Maybe it's possible for it to show up automatically when a session is started?],12,34,,2024-09-12 10:00:53.540409
487,t5xUaGv8QuHF8vAmLTUU86FaXaKLMabF,"[Yes, I am taking notes of this!]",8,34,,2024-09-12 10:01:23.961686
488,Td8gvCcDXZptKh-wAScgCrkjQqzEEL2W,[I am going to underline 2 things in your text so you can try to modify and see what happens!],8,34,,2024-09-12 10:01:42.382302
489,bZfH87dZA5VlXwK0Oy6_K65uT82URf6S,"Oui, ça va bien – j'ai été très ocupé avec faire le fiche descriptive et le syllabus pour mon cours, mais déjà bien :)",12,34,,2024-09-12 10:02:06.030103
490,HnVQWr7pYJJJBeYZHHppIK47WapDGj9N,Tu as bien avancé? :),8,34,,2024-09-12 10:02:34.519975
491,z-R_9UkEcVdciGDJKX_TXk_kMkUdJcCo,"[A note for Serge: the session only shows on the dashboard after clicking refresh. Maybe it's possible for it to show up automatically when a session is started?] [When I edit and make no changes, nothing happens ✓. When I edit and change underlined text, the underline remains ✓. However, if I select underlined text, I can't add a comment or re-underline it; also, if I delete the underlined text, any new text is not underlined.]",12,34,,2024-09-12 10:04:55.818916
492,AmCkSHAg5ydCggdeiQfWgUpcaEK6A8mF,"Ok, je note tes commentaires !",8,34,,2024-09-12 10:06:42.027460
493,SRmvB45scGlHuNsXTiqnO9ZFa3EWAqpR,"J'espere! Maintenant, je suis en train de préparer mes premier courses. Et j'attend à la traduction du fiche descriptive de mes colleagues.",12,34,,2024-09-12 10:06:50.512908
494,Y2PF0uyNBINbbHgfTNImuy1KMgxYOhNR,"Tu as bien ""avancé"" dans ton travail ? = are you progressing well in your work?",8,34,,2024-09-12 10:07:34.924987
495,aA_tYcmeo43zECSSbCVdKTz9rOkPpUHU,"[Interesting: I just tried to overwrite 'avec' because I wanted to comment that I didn't know what the correction should be. But then it underlined the new text with a 'normal' underline, rather than the wavy underline. ??]",12,34,,2024-09-12 10:08:00.748416
496,1MM2GWHFlLHEDe5P4lS5PobCJV8ynyF0,"[I still see the wavy red underline on ""avec']",8,34,,2024-09-12 10:08:40.729856
497,QJhS7iIyr4USz4disIl7Z5yJAmh41TUM,"Ah, je te comprends. Oui, je pense que j'ai bien avancé, mais c'est parfois lentement. Specialement attendre aux autres! haha",12,34,,2024-09-12 10:09:29.155454
498,z2zY_Ce7hSw_ufEI3XoFIfYhuoWyh0uh,"[Oh, that's strange...]",12,34,,2024-09-12 10:10:14.678722
499,T13IvbjcqSgmAGDeglv9pbk4LZ6hEF1x,"Aujourd'hui, je voulais qu'on parle de musique. Si ça te dit, évidemment :)",8,34,,2024-09-12 10:11:07.952755
500,LnxUK2L_-IHuO4zsMSG5WxDsoyM3W0nF,"Si tu as une idée de thème que tu voudrais vraiment 'travailler', n'hésite pas!",8,34,,2024-09-12 10:11:21.637097
501,RbFn99kl3BndLU_xl8LykbPiBMJncOUi,"[OK, that was very strange. You went offline suddenly, when I was writing 'Oh, that's strange'. When I pressed enter, it didn't send. Then I opened LL in a new tab and clicked on the course in progress, and it shows you as online, and my message had been sent.]",12,34,,2024-09-12 10:12:54.742055
502,hj73Kj_xBDUgw3oYjQDfERfgW_tG9p6Z,[You still show as offline in the old tab.],12,34,,2024-09-12 10:13:02.325265
503,0rfWjJr2NaTf0TnkitmN_Lho23B1aXkY,"[Ok, I don't understand why I am offline because I didn't leave LL at all. And it is weird that you cannot send a message if I am not online!]",8,34,,2024-09-12 10:13:52.527753
504,pUiwtUqFN7LDpa2NOJXLxGFcgZhWKUBU,"[I also just heard a rather piercing 'ding' from the old tab... though no new message was sent in it. Seemed to be an alert. Just heard it again when you replied just now (and that message doesn't show up in the other tab). I like that there's an alert, but maybe the sound can be improved a bit...]",12,34,,2024-09-12 10:14:49.325183
505,CmO1O9aY4XC68Zdh-kWaQgr4uPze__JZ,"[Just heard the alert again – I think it's giving the alert also when I send a message, so any new message triggers the alert. Not sure why you suddenly showed as offline. Makes sense in a way that the student can't send a message when the tutor is offline, in order to reduce the possibility of spamming.]",12,34,,2024-09-12 10:16:01.439049
506,Bu2zoOCIA-5UwOS1Vm4faCTDJV3WX7kW,"[And what would the alert be about? When someone is offline? I think I had the same sound at the beginning of the conversation, and you also had the red dot next to your name]",8,34,,2024-09-12 10:16:33.327774
507,z7zEMTI2jNNhLAfNC1yOm7E4-nniV5Dk,"[I think the alert is just for a new message. So if I had gone into another tab or another app, and then you send a message, it lets me know that.]",12,34,,2024-09-12 10:17:23.490747
508,vq3fIMM6OdIMhO87ozDojFIjfQTzfvss,[Couldn't it be just a notification when you receive a message?],8,34,,2024-09-12 10:17:31.512050
509,t6u8MqI0GYM7KMGFD5EAyMlIxG3THff9,"[Oh, ok!!]",8,34,,2024-09-12 10:17:36.062084
510,IOeYwTm2TRhlbtWypUorjOsIfCzBp3LR,"[But OK, so you heard it too. Was it quite as high-pitched and clippy for you?]",12,34,,2024-09-12 10:18:01.413496
511,FfSVIxw-qvJ3kB1CuEY5cPVOtI-DdHKG,"[Yes, exactly. I am keeping my sound on to check if I hear one each time you send me a message]",8,34,,2024-09-12 10:18:31.704908
512,-5Yq-NsIFs__jMxKH-IYZ_1bA5AvhdiN,"[It's like it's a really bad quality audio of a ding, so it doesn't sound very good.]",12,34,,2024-09-12 10:18:39.239817
