id,message_id,content,user_id,session_id,reply_to_message_id,created_at
689,epRWFmWlAxwNZXjYoSacS7BzMikYnhhm,Ton filleul est en Belgique?,8,39,,2024-09-19 10:34:45.019052
690,d3CXm5f10QhQe5TwlcP5YOoDH-z3otwC,Ce sera un moment tellement espécial (jnsp),12,39,,2024-09-19 10:34:55.068679
691,6iYjPK2V8y0-Fc3h3Kh4V133p-XpGMsr,"Oui, j'ai trois filleuls – deux garçons et une fille. Dans la même famille haha",12,39,,2024-09-19 10:35:37.480249
692,qN3R9t681m6AVXjdzm9r08OgNvNr0YqS,"Oui, mais je manquerai l'anniversaire de mon filleul, malheureuxement (malheureusement)",12,39,,2024-09-19 10:36:00.143125
693,xAyKPKnH-GpRKrt9z-4i7peblfcY7Gs6,Waouw! Tu es apprécié dans la famille 🤗,8,39,,2024-09-19 10:36:38.948104
694,T-82KJzSU7hmtjaI7LyqYgi6zBeTd-6K,"Leur maman est américainne, est leur papa est (britain?), mais ils sont nés et ils habitent en Belgique",12,39,,2024-09-19 10:37:27.511304
695,OzwimxCqd2p_8qAmAUNsqY464YXGJRYi,Je les adore beaucoup :D,12,39,,2024-09-19 10:37:46.541623
696,2i5CjUT-JgSRqYzSAyQCTYm2S05yzS8p,C'est trop bien! Moi je n'ai pas encore de filleuls :),8,39,,2024-09-19 10:38:23.871796
697,T-82KJzSU7hmtjaI7LyqYgi6zBeTd-6K,"Leur maman est américainne (américaine), est leur papa est (britain?), mais ils sont nés et ils habitent en Belgique",12,39,,2024-09-19 10:38:43.456579
698,BIP9QVxqXB9GhERBKxOMMLZg5Bihrhts,"Tu retournes donc quand même régulièrement aux USA, comme tu y étais aussi cet été !",8,39,,2024-09-19 10:38:47.801916
699,0eLjA3-1z5Nkdo4ZERToega6OHcV7Ehd,"Oui – j'ai realisé que mes parents deviennent plus vieux, et je veux passer beaucoup moments avec lui pendant je peux.",12,39,,2024-09-19 10:40:03.300352
700,0eLjA3-1z5Nkdo4ZERToega6OHcV7Ehd,"Oui – j'ai realisé que mes parents deviennent plus vieux, et je veux passer beaucoup de moments avec lui pendant je peux.",12,39,,2024-09-19 10:40:15.358548
701,31ERaVV2qhwd_mIF9wxAoy4MrJYgpmIk,"Oui, je comprends!",8,39,,2024-09-19 10:41:04.711781
702,6YDHHDwGkvY6ueqcrWRv5P8g6LonI3ZF,[I took a screenshot of my message about their parents – I see that the blue line isn't aligned with 'britain' anymore after the edit.],12,39,,2024-09-19 10:41:52.418536
703,0eLjA3-1z5Nkdo4ZERToega6OHcV7Ehd,"Oui – j'ai realisé que mes parents deviennent plus vieux, et je veux passer beaucoup de moments avec lui (eux)pendant je peux.",12,39,,2024-09-19 10:42:10.900357
704,8kfWka251iVKwq4trMwhHKnP5_J_O-qI,[Ok. And I cannot confirm you your correction 'eux' in your last sentence because it is already a comment],8,39,,2024-09-19 10:43:01.992065
705,1Kkvy05-12xq-8T8dAP6M8BP5oebDN-G,Et tes parents sont déjà venus en Belgique?,8,39,,2024-09-19 10:43:16.543358
706,M47fqwRYvmevg5C_URbx4madCMgyl-K4,"J'ai manqué beaucoup de temps pendant que le COVID et les difficultés avec mon permit de résidence, alors maintenant, je vais que souvent que possible.",12,39,,2024-09-19 10:43:46.577348
707,GlLRLkE_1CEa52mCmIX1zdwylAGNHjPS,Tu as bien raison!,8,39,,2024-09-19 10:44:34.608394
708,3Ukt_vaGYDBUKFcSNqga_h9dUC2rHeR4,"Mes parents sont venus en Belgique dans 2011 quand j'ai reçu mon masters, et ma maman et mon frère sont venus dans 2019 pour Noël, mais mon papa n'est encore retourné. Il y veut, mais on ne sait pas quand.",12,39,,2024-09-19 10:47:24.351193
709,XJ89lqFyNDoYXYgHsTCN53wA020t9Bpz,"Pour les dates : en 2011, en 2019, ...",8,39,,2024-09-19 10:48:15.854010
710,zo6zU6AUwj_gcbEqL8Psrku6dZJquZ2H,Tu n'as qu'un frère?,8,39,,2024-09-19 10:48:18.740122
711,PWKA7ZV5wmK_gcVhB2Sxg_xXPj0LQSpI,ah oui,12,39,,2024-09-19 10:48:19.740577
712,h2K-aDNzsFu9vCupYEVrpHoJ0gEbyq4z,(I thought so – j'y pense? je pense que?),12,39,,2024-09-19 10:48:43.588758
713,8YO_RrAQwz8f2zB3Cyoomu2fUEfA7OIn,Au passé: je le pensais bien :),8,39,,2024-09-19 10:49:02.898367
714,7TtJ5d3Lfp6MxuBeZcGhjdOgNRLoDFXf,"Oui, j'ai qu'un frère, il est deux ans plus jeune que moi. Il est militaire et il travaille dans le Pentagon maintenant – tellement chouette haha",12,39,,2024-09-19 10:49:58.116594
715,Bjj_VinFAKDsUQpJU8mGZwrzC7qJukPV,"Et toi, as-tu des frères ou des sœurs?",12,39,,2024-09-19 10:51:01.329314
716,4eHrI6DHFSqeVLqZE4sqh6X9gOMMI9AG,Tu as déjà pu visiter le Pentagone?,8,39,,2024-09-19 10:51:26.401118
717,KkA2vpa1mh4KPphYbV0XTyOm1msB-cD9,"Oui, j'ai une grande soeur de 27 ans.",8,39,,2024-09-19 10:51:42.098259
718,VVYBg8uxr2zmmBDVZmdH9AHYNmzjrbst,Elle est professeure d'anglais et de néerlandais !,8,39,,2024-09-19 10:51:52.188377
719,VlP2FCNeeUQce_kdVwzvjVCNYROdNbj8,"Oui! Cet été, mon frère a y vu mon papa et moi. Je ne pourrais pas faire des fotos... très (secure?)",12,39,,2024-09-19 10:53:20.701098
720,XVNsEGOO9EU9Vt2nQhIiz-3gLdWFjr2m,J'imagine! C'est un métier très sérieux!,8,39,,2024-09-19 10:54:02.806221
721,18wq-q2NSYyC_2J0Of0TD1AaNw6gRUug,"Oh, chouette! Tu et ta sœur sont le deux linguistes!",12,39,,2024-09-19 10:54:09.362754
722,vxBpHC2MzQWw-RvHYDdpWg9xR0fkSWqF,"Oui, grâce à nos parents :) Mes parents parlent français, italien, espagnol, anglais et néerlandais !",8,39,,2024-09-19 10:54:42.250061
723,VlP2FCNeeUQce_kdVwzvjVCNYROdNbj8,"Oui! Cet été, mon frère a y vu mon papa et moi. Je ne pourrais pas faire des fotos (ah, c'est néerlandais haha – photos)... très (secure?)",12,39,,2024-09-19 10:54:45.499256
724,Ic5Q5JUBcJ4Mel1EJcy7VxDW6ZC7xhqI,Tellement beaucoup de langues!,12,39,,2024-09-19 10:55:05.913975
725,eYrUGMfWU04S1gAm9f47al3czjy-VW4j,"Pour notre prochaine session, est-ce que tu es libre ce lundi? Comme je pars mardi et que je n'ai pas encore mon horaire, je préfèrerais ce jour-là, tant que je suis encore en Belgique !",8,39,,2024-09-19 10:55:13.365893
726,eDAbyy7WDfhjEGSZv5YjObPxZjzJamaM,"Oui, ce lundi est bon, mais si tu veux (ou as besoin de) temps pour te préparer pour ton voyage, on peut attendre quelques jours",12,39,,2024-09-19 10:56:43.623838
727,B68CRt10axznrIG1_k45rLoGPvi5PeeM,"Normalement, ça ira, mais si jamais je vois que je n'ai pas assez de temps, je t'enverrai un email !",8,39,,2024-09-19 10:57:29.425563
728,S-J3yyaTNiPSbpLDPA3YaekLh4bGA0V5,On dit lundi à 10h aussi ?,8,39,,2024-09-19 10:57:39.344001
729,y1iUrwwwE-fM4lSa8-MXMxo5dGiIl-9X,"OK, c'est bon! Lundi à 10h – parfait :) Et je t'envoi aussi les screenshots pour Serge",12,39,,2024-09-19 10:58:30.979441
730,7exhUn_NmaMCvXducaC6DtFiqZ3RHXK0,"Oui, parfait !",8,39,,2024-09-19 10:58:53.523812
731,_LCS6ytDOIcSY2hkX3GooM3Im_pmOa8K,Merci beaucoup Victoria! Et bon chance avec tes préparations!,12,39,,2024-09-19 10:59:00.387831
732,OGoXeSikVdV0fBdcYxRT35aRQ4UP999O,"Merci beaucoup pour tout, Tyler, et bon week-end :)",8,39,,2024-09-19 10:59:12.555129
733,y1iUrwwwE-fM4lSa8-MXMxo5dGiIl-9X,"OK, c'est bon! Lundi à 10h – parfait :) Et je t'envoi (t'envoie) aussi les screenshots pour Serge",12,39,,2024-09-19 10:59:16.166249
734,mjm-QrTLCLpimuXovCACFXEn541pFk3m,Bon week-end!,12,39,,2024-09-19 10:59:27.627963
735,9Ds0LWIVdiRKyQ06wQ_Dn_03DGcQksBl,Test,1,40,,2024-09-20 16:07:18.581716
736,q5hO5F3R-rE1SCppX6CgviXfj2G7bybV,Salut Tyler :),8,42,,2024-09-23 07:59:51.341133
737,p1ZRQa_yuSPD07QlMuWCaydtHpJZs9ej,"Salut, Victoria!",12,42,,2024-09-23 08:00:27.554524
738,l7xMdSwbwPlZFnc3qVdxCtFeCFHt39uU,"Comment tu vas, aujourd'hui? :)",8,42,,2024-09-23 08:00:44.119187
739,YWIru8VI-mXfeEl1OwnMLaTdPNlhfZu_,"Tu as peut-être dû remplir le formulaire avec ta date de naissance à nouveau? L'étudiant en informatique a dû supprimer certaines infos, donc il apparait à nouveau !",8,42,,2024-09-23 08:01:11.774707
740,vIW0mynkaoewkgGoBSuqobw-JR5obEVh,"[OK an interesting start: At the top of my screen is a banner saying 'Veuillez compléter le formulaire d'inscription avant d'utiliser l'application'. When I click on it, I'm taken to the form I filled out when I first made my account with LL. After I put in my information and click 'next', it says 'cannot update user'.]",12,42,,2024-09-23 08:01:53.712524
741,YJ8gdXhicm0nQqdhqgD_4WU2heIhio9b,"[Same! I made a sceenshot to sent it to Brieuc. He informed me that we would have to complete the form again, so I wasn't surprised, but it isn't working!]",8,42,,2024-09-23 08:02:41.743492
742,AOFbhI1BVqlDWVcQAnGWfIMaN5e8qwmo,"[Then, when I went back to the dashboard, I saw two instances of our session for today. I clicked on one, and you appeared with a red dot. I went back and clicked the other, and you still appeared with a red dot. I went back to the first, and you had a red dot which turned green when you sent your first message.]",12,42,,2024-09-23 08:02:46.107449
743,YJ8gdXhicm0nQqdhqgD_4WU2heIhio9b,"[Same! I made a sceenshot to send it to Brieuc. He informed me that we would have to complete the form again, so I wasn't surprised, but it isn't working!]",8,42,,2024-09-23 08:02:50.296657
744,tLgIfLnCRw9gkZ1rZBKPebzaA77OoiYl,[But the good news is we can still have our chat despite not having completed the form. I was worried it was going to block us from having our session.],12,42,,2024-09-23 08:03:23.629354
745,XLSSRyWckR0Ff0iwJ7N1IxNkD5Ou1jmd,[I just took a screenshot of my dashboard; I'll send it to you after.],12,42,,2024-09-23 08:04:22.403960
746,vUIuN0wAsV-jMEjh_EfjipZTrsPzGRvI,"[The two open sessions are all my fault. I clicked two times by error to start a session, so both directly appeared! But regarding the red dot, that is strange, because I was in Language Lab! I think that the conversation where a message has been sent should show it one way or another, because when we have several open sessions, we don't know which one to use]",8,42,,2024-09-23 08:04:53.253701
747,XKGsm50ULksCWW7M7Dqdsb8avoSoW5FP,"[Ah, OK. I wonder if you show with a red dot until you send the first message?]",12,42,,2024-09-23 08:05:37.367435
748,tgJsff1XW--qYEEEjJ45gN4OLYI3F-ZK,[So the tutor has to initiate the conversation?],12,42,,2024-09-23 08:05:48.937197
749,bX-ZtAADOE2O6iSU4L2rme77sFUBX6io,"[That's possible. Each time I am sending you the first message, you also have a red dot. But I assumed that you weren't online yet]",8,42,,2024-09-23 08:06:10.979890
750,LcqctOPo08pUYP8IiIvX0LP8niFY-zG-,"[Normally, you should be able to start ""une session immédiate""?]",8,42,,2024-09-23 08:06:33.708724
751,fd-ROMG94sgidgMR-0uXY4_yDegnJXnL,"[You have a red dot on the today's other open session. Maybe when you are writing in a chat, you appear offline in others]",8,42,,2024-09-23 08:07:12.323264
752,Tqvr0A7KhPJWCAFS2qXxnxTzoD2DTQyO,"[OK, that's interesting. So previously, I've been in the dashboard waiting for the session to show up. When I click on it, you've already sent your first message. So it must not show me as active until I've joined the session, even if I'm in LL already.]",12,42,,2024-09-23 08:07:14.965410
753,bYO-pGEwKaou5rHVTfi2oKePKvrP11LS,And can you see anything here?,12,41,,2024-09-23 08:07:33.046996
754,6zl0Js5itdZS4njuTMW_GSuJs7iYmYlH,"[I just went to the other session – you have a red dot, but I was able to send a message.]",12,42,,2024-09-23 08:07:57.703409
755,OcMBNCDMpew1DxrnRgLs1MJcS79Rn0IH,"Yes, I can :)",8,41,,2024-09-23 08:08:14.512848
756,U60oCUN9Njb24V8L5Gxw7xbhp2v_7XRs,Interesting... haha,12,41,,2024-09-23 08:08:25.866955
757,EVjdeiWRGoI9qWAVEy93Saq4HX9qDAuy,"[Ok, so the main thing to adjust is the red dot, because Serge wanted us to try to chat with two or more learners at the same time. So it would be confusing if we have a red dot each time we open another conversation]",8,42,,2024-09-23 08:09:00.221829
758,peXm8adEtfFNcElcRydx9-1lZ3-f74zN,And if I start a new session,12,43,,2024-09-23 08:09:04.715336
759,fjmLUAPPgKaSyxvwkZBUZO8wEa06PHeg,"[Yes, indeed. I just started an immediate session, and I was able to send you a message, despite you having a red dot.]",12,42,,2024-09-23 08:09:37.973452
760,FIyYardvPPvKv_FVC3b16pJk0AtUEfoh,"[So that's something we'd mentioned before, the student being able to send a message when the tutor is not yet online.]",12,42,,2024-09-23 08:09:58.645131
761,YdKlWWvY8Gr_40Wu6T-DvmtrEUt3UZhL,"[Can you go to that session, and I'll see what happens with your dot in this one?]",12,42,,2024-09-23 08:10:13.081822
762,sjM7Kw06E_uA7aLUdSu7BF74cicJtL5k,It is working :),8,43,,2024-09-23 08:11:12.490959
763,yrL8E9e23ZXl8F9sET-EQ2yANx9IlMYo,[I was on the other conversation and you appeared online for a moment],8,42,,2024-09-23 08:11:42.996022
764,9szp_E5h1odQUrlaJ9TXm_ZM2SENpcoE,"[OK, and you appear online until you send a message in another chat. So you were green until I received the message 'It is working'; and as soon as you sent this message, you turned red in the other session.]",12,42,,2024-09-23 08:12:29.120789
765,K9x6TiOdcu5z2xjJkbAXDZ9dd-LNJqbV,"[So the dot colour doesn't change when you're typing, but only when you send the message.]",12,42,,2024-09-23 08:12:47.076424
766,UelnKHL0d4l79fhdYPUZoNl5L-2kIoOv,"[But indeed, it would be confusing (and disconcerting) for the student if the tutor's dot keeps changing between green and red]",12,42,,2024-09-23 08:13:07.746938
767,sR1SQART9NOEsY-0wGu1F8BIIWHog9y7,"[The alert sound is a bit better, not quite as clippy.]",12,42,,2024-09-23 08:14:39.563845
768,-SVeGKXB6tsAq21aAErG1j579_rjg3eh,"[There was also something we were going to try at the start of this session, but I don't remember what hahaha Do you remember?]",12,42,,2024-09-23 08:15:25.079466
769,refGxs9jkA6XhoycCBUYjjY5Mzett2VP,"[Oh yeah, we were going to see what happens if you full on close out of LL and then come back in, whether you show as offline, whether you reappear as online, if I have to refresh the window, etc. Shall we give that a go?]",12,42,,2024-09-23 08:16:38.842469
770,JT4dhDasRxT7SkNbBpwWu546cPSvPE5w,"[Yes, I agree with your insights and took notes for feedback afterwards! Ok, I am closing LL]",8,42,,2024-09-23 08:17:19.748201
771,fo03Trvr6t9OEFDc1dAXzc__nN1LkVlU,[Dot just turned red],12,42,,2024-09-23 08:17:58.563812
772,BFigbrEClHnYXva2wKOwL25SdonFsUeq,[And turned green again],12,42,,2024-09-23 08:18:11.019427
773,xH9iLYk16BkNNAJoJrgvxL7B9Hi5eAL9,"[Ok, this time it seems logical!]",8,42,,2024-09-23 08:18:15.115490
774,mrxm3GEd-77BiI926uu268B8UtMh3cUp,"[Yes! Only thing is that you came back in a bit too quickly haha so I wasn't able to try to send the message while the dot was still red. But I think we saw already from the session I started that I was able to message you even when your dot was red, so that should be OK.]",12,42,,2024-09-23 08:19:02.867472
775,8X5Q3Sal4p3CK4cFrhH9lUVGBzE3q98G,"[I did not have to refresh the window, or go back to the dashboard and re-enter the chat.]",12,42,,2024-09-23 08:19:31.964746
776,QgDYx_olUwMNVcX4pJv-0_8BcbwYRWio,"[Oh, sorry! I am closing everything again so that you try this for sure!]",8,42,,2024-09-23 08:19:36.796375
777,XH2IQDX3VUbj2_iSv8JjXHM_5srqwfOx,[OK!],12,42,,2024-09-23 08:19:46.795934
778,v-KGsTcd7V-ijs3z1vgZYyFCSWFmKKsf,[Red dot],12,42,,2024-09-23 08:20:21.840600
779,m-9BxUfyEDwzNYZnSYqDLekh0iGBWXZy,[Message sent with red dot],12,42,,2024-09-23 08:20:28.560927
780,Ku9ZfRhn1Rv8tLYq2C3DeTAeGSe6g9n-,[blah blah blah],12,42,,2024-09-23 08:20:54.988286
781,Tw6Kp6G0nnD8GhkR_bUAKtee15IGTSAG,[I sent four messages after your dot turned red. Can you see all of them?],12,42,,2024-09-23 08:21:31.917747
782,HN-2XkxC3aaOAx3WbvDPqXwuWdUEezrH,[Ahahah],8,42,,2024-09-23 08:21:33.148713
783,KvyJLhViJBXHn4Ic5D0xSET0s4vAMQUA,[Perfect then!],8,42,,2024-09-23 08:21:37.402338
784,pqzi8g7Gk9Pa7BjqBzUc-xs7kC73AFxm,"[Yes, I can]",8,42,,2024-09-23 08:21:44.665822
785,k0m2LBARs8enqUb9IfnZw9nBRZEnUI79,[Perfect! That seems to be working well – bravi to Serge and the IT team!],12,42,,2024-09-23 08:22:01.295557
786,l-oO5S_1OtdMmVV_fj5RVYt1dBlfp0zc,"Je reprends en français :) Avant de commencer, j'ai une question importante à te poser, je t'explique : en fait, je ne serai plus étudiante à partir du 30 septembre. Donc, je dois 'réserver' mes heures de travail à l'avance d'ici fin septembre. Je dois donc anticiper combien d'heures il nous reste ensemble, toi et moi. Logiquement, c'est notre 6e conversation ensemble aujourd'hui. Il en restera 2 officiellement.",8,42,,2024-09-23 08:22:28.002529
787,CYnMuLu2i-weGLyJ26z7jbVvqyg7seXp,"[OK, shall we get back into it then?]",12,42,,2024-09-23 08:22:29.159733
788,fYsKGw8aZOdDiUvt2YBKPQTATdNEFcX2,"Mais Serge m'a dit que si nous voulions faire plus d'heures ensemble, nous pouvons. Je voulais donc avoir ton avis. Tu voudrais qu'on reste sur 2 dernières sessions ensemble, ou plus?",8,42,,2024-09-23 08:23:00.765603
789,rjg8IIuQZLqmdImi9rkTLHE7Qpuk-M7f,"Si je te comprends, tu me demands si on peut faire 2 sessions plus avant 30 septembre parce qu'après-la, tu ne seras pas plus étudiante. Est-ce que je suis correctement?",12,42,,2024-09-23 08:25:40.710895
790,CTalW5CsNi07MQpoqaJKaG-nhdmlfVdS,"Non, non. Je dois anticiper le nombre d'heures où je travaillerai après le 30 septembre. Mais nous, on peut continuer à se parler en octobre, novembre, peu importe. Il faut juste qu'on décide combien d'heures on voudrait encore faire ensemble :)",8,42,,2024-09-23 08:26:29.980751
791,uYlNkxeZ8i-o7sksBnLjZ2o8vvALVyMk,"[I have to report to Serge the number of hours I will be working after September 30th. So our chats won't be necessarily before that date, but we have to decide how many hours we would like to chat together in the future :)]",8,42,,2024-09-23 08:27:34.204248
792,iefry59Sk144cCKgrOsB6G3YyegmyIGP,"Ah oké – pour moi, ce n'est rien, je suis content à continuer (however long).",12,42,,2024-09-23 08:28:05.383936
793,bNpMVc86UXWZHItAEJcUAWC3KlwOiWtW,La pratique est très utile pour moi :),12,42,,2024-09-23 08:28:46.956947
794,pzUaMROfNeU7B36eTo-EWAnvLVxSuVNQ,"[Officially, it was set on eight 1-hour-long chat, but Serge told me that, as we give him interesting feedbacks and are still trying new things, we can keep chatting together longer]",8,42,,2024-09-23 08:28:59.283704
795,BmNjK4Hz-zvQnVMwZovBBFNxMqf-3vYR,C'est bon!,12,42,,2024-09-23 08:29:15.990744
796,hUVn5yrkd0PPjhM-YpXQlUnYK2_sH0rt,"Ok, super :) Moi aussi, ça m'entraine bien. Combien d'heures t'intéresseraient alors? Encore 5?",8,42,,2024-09-23 08:29:29.477299
797,xn_e2PcdoGGKSV69K226Wqxe_VJVLlho,"[I'm glad that our feedback has been so helpful for him, too :) ]",12,42,,2024-09-23 08:29:43.031795
798,yPhdEApskR57CmszKkgJwiq9Oe9yRimP,"(Yes, me too! He seems very happy with our work!!$",8,42,,2024-09-23 08:30:09.501363
799,yPhdEApskR57CmszKkgJwiq9Oe9yRimP,"(Yes, me too! He seems very happy with our work!!]",8,42,,2024-09-23 08:30:19.423929
800,pzUaMROfNeU7B36eTo-EWAnvLVxSuVNQ,"[Officially, it was set on eight 1-hour-long chats, but Serge told me that, as we give him interesting feedbacks and are still trying new things, we can keep chatting together longer]",8,42,,2024-09-23 08:30:33.049269
801,TUQQw47p1c-gbt_79YEREkAB8-TjGAIz,"Bon, on dissait 5, et on peut adjuster si necessaire.",12,42,,2024-09-23 08:30:41.046492
802,XzrIgcMSd1aIIcadI95HzVNMnQ_AKWBx,"(I tried the conditional there, but I haven't really learned that yet...did I do it correctly?)",12,42,,2024-09-23 08:31:02.096718
803,5Y33ZmwPv4YesOPnk63M7F87S_J81333,"(""Let's say five"" is what I was going for)",12,42,,2024-09-23 08:31:23.091781
804,LToN56ERjYhMJwx93AR4ndr4IcLpx4Oy,"On dit plutôt ""On va dire 5"", ""On peut dire 5"" : mais pour le conditionnel, c'est ""on dirait""",8,42,,2024-09-23 08:32:01.992927
805,Fcq_8Mi585oVe6ehD7wRGCCCf3bKGwVR,"(is that correct use of the conditional, to make a suggestion like that?)",12,42,,2024-09-23 08:32:38.473238
806,Tmnx25_tpN0CNur-4Gzm0faDHqXLgo_R,"Oui, on utilise le conditionnel surtout que ce dont on parle n'est pas certain. Aussi pour exprimer un souhait (a wish: j'aimerais tant être riche 😅), ou pour une condition avec 'si' (si j'avais le temps, je lirais 10 livres chaque jour)",8,42,,2024-09-23 08:34:41.847078
807,UrUGtHejJ2w7H2mfrafz9bPUifd6IrTf,"Donc ici, c'est très bien de me dire ""tu pourrais lui dire 5 heures, et on verra pour la suite"", car ce n'est pas sûr et confirmé :)",8,42,,2024-09-23 08:35:04.194729
808,z_1Mzl5ajb8eJpKFZ69YvnthpV9kcb4J,"(Ah, ok, and then when I respond, I should use a more definitive mood to confirm, rather than using a conditional which still seems uncertain?)",12,42,,2024-09-23 08:35:44.798248
809,7Wm_3b-HKqU3chpAk70unShLUd9ukPnx,"Ca dépend vraiment ! Si on parle d'un projet de voyage par exemple, tu peux utiliser sans cesse le conditionnel comme rien n'est fixe. Par exemple : une fois à Londres, je prendrais normalement le train de 10h. Si je suis à l'heure, j'achèterais un sandwich à la gare, ...",8,42,,2024-09-23 08:37:56.187127
810,6_8UhRDKHaxFPWuqZd7QF6JaDVjoKyF0,"Ca dépend du sens pour savoir si tu sais confirmer, ou si ce ne sont que des hypothèses !",8,42,,2024-09-23 08:38:22.349024
811,SNOpK0kdK3qUb7qxd0EQoqY_8PuwQYf_,"Et donc, justement, quand tu pars à Londres prochainement, tu y vas en train?",8,42,,2024-09-23 08:38:47.546795
812,WTR_axylGjprR-xMV9HKigJLZAprHUUt,"OK, bon! Merci pour l'explication :) Et comment vas tu avec tes preparations pour aller au RU?",12,42,,2024-09-23 08:39:14.910890
813,d4rb5emk1S6QCfpCtkq95gzhCkkGEDA2,"Oui, j'y vais en train – je déteste le bus! haha",12,42,,2024-09-23 08:39:40.240248
814,cwQXb0ZOzVThJl3QRqqOvJ3D8VLQdi6b,"Je dois encore terminer mes valises aujourd'hui ! Sinon, j'ai dit au revoir à ma famille et mes amis. Et du côté administratif, tout est bon !",8,42,,2024-09-23 08:39:51.655712
815,PrSjrdEDFg940rr31U_Jqquyq_sFpFBJ,"Tu prends l'Eurostar alors? Oui, c'est vrai que les bus sont beaucoup plus longs... Et moins bien organisés, je trouve!",8,42,,2024-09-23 08:40:15.562975
816,3AUuvKMVhjr0Hnn7iNgwj9ta3MoBG4st,"Il y a 2 ans, j'ai pris le bus avec des étudiants pour le voyage du 6e (year, as in school), et c'était un peu horrible haha",12,42,,2024-09-23 08:40:57.778127
817,T3yVYWZCXNYoltzGXXFQQS5kQAty3RVL,6ème secondaire :),8,42,,2024-09-23 08:41:39.761409
818,FzmoRRphqmqJL0AUUjz-v9RVSTYpPKV5,"En Belgique, on dit aussi ""en rhétorique"", ""en rhéto"" :)",8,42,,2024-09-23 08:41:50.450117
819,Ncumc_D1yyl0f1eOg9fjui22znmghR0C,"Oui, je prends l'Eurostar de Bruxelles-Midi à Londres-St Pancras, et puis le métro à Kennington, où mes amis habitent",12,42,,2024-09-23 08:42:29.731901
820,Xn6M2R6RxG9qCBbRUmJ3exE6Tao5KhOB,"Ah oui! Moi aussi, demain je fais Bruxelles-midi jusque St Pancras :) Et puis, je fais Londres - Bedford encore en train !",8,42,,2024-09-23 08:43:16.417267
821,36PD5QkvOCyn3ximC7eLUiA7ecIOUBfx,Les trains du RU ne sont pas les mieux haha,12,42,,2024-09-23 08:44:02.175263
822,i-AD8Lz-HLxK-9Z6FisW8GA4VFeE60dQ,C'est vrai? Je n'en ai jamais pris là-bas!,8,42,,2024-09-23 08:44:18.832638
823,5ogFe4zrfsL0DmCxmtZHE8zl1wJH5FMH,Mais parfois meilleur qu'en Belgique haha,12,42,,2024-09-23 08:44:27.989127
824,XR2uoiSL9lg8CB_LVZb1TkW8WPFOGWhR,"En Belgique, ils sont toujours en retard 😅",8,42,,2024-09-23 08:44:53.453925
825,uXBGT0SnzNihuj85rgcYpXJTK4wPsxm7,Ils ont une 'reputation' haha,12,42,,2024-09-23 08:44:54.506628
826,GcVwSxq2NjMYyLJnBU4U0NnKeoupVZ0P,Toujours! C'est incroyable!,12,42,,2024-09-23 08:45:04.140397
827,QDXDRWYAGniPTQO6i-73iSmfSLjSXT1p,"Et toi, tu dois être habitué à l'avion, pour tes trajets jusqu'aux USA!",8,42,,2024-09-23 08:45:43.084353
828,QjBLtnrFrRg_3jcs-LS_-Fdm36I8NqMy,"Ils sont chers et aussi en retard, ou annulés!",12,42,,2024-09-23 08:45:50.459612
829,FMIoqdqNwK5WbrA3MC8IHFGvyIy2bob6,"Oui, c'est vrai... Cet été, j'ai été à Anvers avec ma soeur. Elle a dû payer 35€ de train (moi, j'ai encore le tarif 'jeune'), et il n'y avait pas l'air conditionné! Il faisait super chaud! C'est honteux, vu le prix",8,42,,2024-09-23 08:46:40.457811
830,r7JKJMtmyEUsuXE-PJtRVzoQJ72teYY8,"Oh, oui, mais j'y ne suis pas été aussi souvent que j'aimerais ... mais j'éspere plus souvent dans le futur",12,42,,2024-09-23 08:47:36.589539
831,lsYUmYrIUtp96rEY2ZAN8BwI1MBttTkR,Ca coûte souvent cher aussi! C'est un sacré budget,8,42,,2024-09-23 08:48:23.700611
832,_iNBVlNEqItQU5SdcgkTq2T0TiwxlG4i,Euh! (That must have been) horrible!,12,42,,2024-09-23 08:49:56.656432
833,1ueHJadw87XoE934d3YW4ubY8v_idK8W,"Jusqu'ici, je trouve que le moyen de transport le plus facile, c'est le métro. C'est facile à comprendre, et il y en a beaucoup plus souvent que des bus/trains. Evidemment, il n'y en a pas partout.",8,42,,2024-09-23 08:50:55.817459
834,dQC5_ERQNqQ54SHSyFnm78upoD7zAnpc,(Je me oublie toujours où 'y' va dans les temps differents...),12,42,,2024-09-23 08:51:16.342743
835,bqsvSToWbNLN4OBRkwJXqnsxrDeD0zfq,(Ça a dû être horrible!),12,42,,2024-09-23 08:52:09.023964
836,aog3aBfhTOtn5le9FwBAh7heFIkDGRL0,"Moi, je préfère l'auto, je dois admiter ... mais je suis américain, donc nous conduissons partout",12,42,,2024-09-23 08:53:19.675430
837,umChy-x-yVmvH9l1kfeg6KtLLNRtjBK2,"L'auto est, je pense, le plus utile",12,42,,2024-09-23 08:53:44.640738
838,PIT_pajYHIp3OYHKM4hl9YdSNRmYVld2,"Moi, je n'ai pas encore de voiture à moi. J'emprunte celles de mes parents. Mais je n'aime pas trop conduire, ça me stresse 😅",8,42,,2024-09-23 08:53:48.596507
839,h82Ego9wgi-xVyKVdxirGuONIQf82jME,"Chez vous, ce sont des automatiques ! Je préfère conduire ça aussi que des manuelles",8,42,,2024-09-23 08:54:02.923657
840,GBGfYAHiyBY-8tPlDeY3-Hn34L6kvbQo,"(Yeah, mostly, it sometimes comes before the auxiliary verb, sometimes after, sometimes before the object 'me' 'te' etc., sometimes after...)",12,42,,2024-09-23 08:54:34.984816
841,bWWuaYAJd4KMbxrynM7dbEctABii7c-x,"Oui, c'est vrai qu'il n'y a pas une règle simple à retenir pour savoir ou le placer.",8,42,,2024-09-23 08:55:01.290870
842,aog3aBfhTOtn5le9FwBAh7heFIkDGRL0,"(trying an edit not near the underline) Moi, je préfère l'auto, je dois admiter ... mais je suis américain, donc nous conduissons partout",12,42,,2024-09-23 08:55:33.958545
843,eVznKOU5V7x_Ph6WXj4zhw74pEDO3dbA,"Pour notre prochaine session, je n'ai pas encore mon horaire à l'école. Maisi je ne commence à travailler que le 1er octobre. Donc, le lundi 30 m'irait. Et toi, es-tu disponible ce jour-là?",8,42,,2024-09-23 08:55:59.767390
